{"as_of":"2026-10-10T20:08:28Z","event_id":"evt_9e366875bfe1afb59fa0","generated_at":"2026-10-10T20:08:28Z","kind":"market_history","links":[{"label":"event","path":"explorer/events/evt_9e366875bfe1afb59fa0.json","rel":"EVENT_RESEARCH","target_id":"evt_9e366875bfe1afb59fa0","target_kind":"event_research"}],"quality":{"coverage":null,"data_as_of":"2026-10-10T20:08:28Z","generated_at":"2026-10-10T20:08:28Z","limitations":["no captured market of this event yet"],"methodology_version":null,"missingness":null,"production":true,"sample_size":null,"source":"data-archive kalshi/markets","source_version":null,"status":"UNAVAILABLE"},"run_id":"run_15b4cd254dab113d4817","schema_version":"edge_finder.app.v1","series":[],"sport":"NBA"}
